{
  "contract": "deployment_profile_v1",
  "profile_id": "fictional-prod-sg-v1",
  "environment_id": "production-sg-v1",
  "trust_domain_id": "xueqing-native-prod-sg",
  "provider_id": "supabase",
  "project_origin": "https://fictional-xueqing.supabase.co",
  "publishable_key": "sb_publishable_fictional_public_only_00000001",
  "required_edge_region": "ap-southeast-1",
  "capabilities": [
    "auth",
    "database-rpc",
    "edge-functions",
    "private-storage"
  ],
  "source": {
    "repository": "qbjsdsb/xueqing-native",
    "commit": "0123456789abcdef0123456789abcdef01234567"
  }
}
